### ISSUE TITLE
Investigate & verify DNS SRV functionality in iOS SDK

### ISSUE THREAD

**Issue by atsakiridis** [RestComm/restcomm-ios-sdk#618]

**Comment by atsakiridis** [comment]
No impacts are needed in the SDK side, it works out of the box:
```
13:04:16.321443 IP iphone-antonios.54219 > 192.168.2.1.domain: 13024+ NAPTR? staging.restcomm.com. (38)
d.l'L......0..E..B.W..@..............5...d2............staging.restcomm.com..#..
13:04:17.414793 IP 192.168.2.1.domain > iphone-antonios.54219: 13024 0/1/0 (122)
.....0d.l'L...E.....@.@............5......2............staging.restcomm.com..#.............H.ns-1665    awsdns-16.co.uk..awsdns-hostmaster.amazon......... ......u...Q.
13:04:17.419499 IP iphone-antonios.54219 > 192.168.2.1.domain: 13280+ SRV? _sips._tcp.staging.restcomm.com. (49)
d.l'L......0..E..M-...@..............5.9.a3............_sips._tcp.staging.restcomm.com..!..
13:04:17.601621 IP 192.168.2.1.domain > iphone-antonios.54219: 13280 1/4/7 SRV sip.restcomm.com.:5061 0 5 (382)
.....0d.l'L...E.....@.@............5....d.3............_sips._tcp.staging.restcomm.com..!.....!.....,.........sip.restcomm.com..G.......O...ns-473    awsdns-59.P.G.......O...ns-1665    awsdns-16.co.uk..G.......O...ns-514    awsdns-00.net..G.......O...ns-1265    awsdns-30.org..a...............a..........&...S..................."O.............."O..&...S....................`...............`..&...S.......................&...S...........
13:04:17.611636 IP iphone-antonios.54219 > 192.168.2.1.domain: 13536+ A? sip.restcomm.com. (34)
d.l'L......0..E..>....@.@............5.*tP4............sip.restcomm.com.....
```
